{
  "id": "scene-container",
  "name": "Scene container and safe frame",
  "kind": "group",
  "status": "experimental",
  "description": "Full-frame scene wrappers driven by autoAlpha, plus a safe-area frame computed per format by scripts/studio.py formats.",
  "rendering_engine": "css_dom",
  "library_dependencies": [
    "html-css-native"
  ],
  "inputs": [
    {
      "name": "--safe-*",
      "type": "css",
      "description": "Safe-area insets written per format"
    }
  ],
  "implementation": {
    "location": "src/studio/studio-base.css",
    "api": ".st-scene (hidden until shown) / .st-safe (format safe area)"
  },
  "validation": {
    "evidence": "Runtime self-test tests/test-studio-runtime.py and frame review of projects/masala-chai-recipe (landscape, portrait, square) in Playwright Chromium on Windows, 2026-10-30. Not yet rendered through HyperFrames on the Apple M2 host, so not approved.",
    "last_verified": "2026-10-30"
  },
  "tags": [
    "scene",
    "layout",
    "safe-area",
    "format"
  ],
  "metadata": {
    "author": "MotionLab",
    "created_at": "2026-10-30",
    "updated_at": "2026-10-30"
  }
}
