{
  "id": "styled-text",
  "name": "Styled text roles (display, heading, lede, body, kicker)",
  "kind": "text",
  "status": "experimental",
  "description": "HTML text using the format-relative type scale (--u, 1% of the short side) and style-system font tokens.",
  "rendering_engine": "css_dom",
  "library_dependencies": [
    "html-css-native"
  ],
  "inputs": [
    {
      "name": "role",
      "type": "class",
      "description": "One of the .st-* type roles"
    },
    {
      "name": "font tokens",
      "type": "css",
      "description": "--font-display / --font-text / --font-mono"
    }
  ],
  "implementation": {
    "location": "src/studio/studio-base.css",
    "api": ".st-display / .st-heading / .st-lede / .st-body / .st-kicker / .st-mono"
  },
  "validation": {
    "evidence": "Runtime self-test tests/test-studio-runtime.py and frame review of projects/masala-chai-recipe (landscape, portrait, square) in Playwright Chromium on Windows, 2026-10-30. Not yet rendered through HyperFrames on the Apple M2 host, so not approved.",
    "last_verified": "2026-10-30"
  },
  "tags": [
    "text",
    "typography",
    "type-scale"
  ],
  "metadata": {
    "author": "MotionLab",
    "created_at": "2026-10-30",
    "updated_at": "2026-10-30"
  }
}
